created_at,id_str,full_text,quote_count,reply_count,retweet_count,favorite_count,lang,user_id_str,conversation_id_str,username,tweet_url,token,positif,negatif,sentiment_score,sentiment
Sun Dec 04 11:56:39 +0000 2022,1599372106168299521,sop balas email butuh urgent coba restart shut down tingkat os tidak bisa buka aplikasi jenius bantu bank btpn dekat booth jenius dekat,0,1,0,0,in,126482224,1599283642744074242,NizzaCassie,https://twitter.com/NizzaCassie/status/1599372106168299521,"['sop', 'balas', 'email', 'butuh', 'urgent', 'coba', 'restart', 'shut', 'down', 'tingkat', 'os', 'tidak bisa', 'buka', 'aplikasi', 'jenius', 'bantu', 'bank', 'btpn', 'dekat', 'booth', 'jenius', 'dekat']",2,1,1,Positif
Fri Dec 02 08:14:21 +0000 2022,1598591384293736453,top up dana kartu debit jenius simpan aplikasi dana,0,1,0,0,in,1063785245583921154,1598572758686109696,everypoet_ri,https://twitter.com/everypoet_ri/status/1598591384293736453,"['top', 'up', 'dana', 'kartu', 'debit', 'jenius', 'simpan', 'aplikasi', 'dana']",1,0,1,Positif
Fri Dec 02 07:45:11 +0000 2022,1598584047881838592,aplikasi jenius android problem login tidak bisa loading koneksi inet kencang buka tidak kenapa,0,1,0,0,in,34574923,1598584047881838592,ryandiardin,https://twitter.com/ryandiardin/status/1598584047881838592,"['aplikasi', 'jenius', 'android', 'problem', 'login', 'tidak bisa', 'loading', 'koneksi', 'inet', 'kencang', 'buka', 'tidak kenapa']",1,1,0,Netral
Fri Dec 02 06:24:20 +0000 2022,1598563697785733121,rekan jenius aplikasi kayak gerak cepat pintar tidak template doang,0,0,0,0,in,119016243,1598563697785733121,pertiwiyuliana,https://twitter.com/pertiwiyuliana/status/1598563697785733121,"['rekan', 'jenius', 'aplikasi', 'kayak', 'gerak cepat', 'pintar', 'tidak template', 'doang']",2,0,2,Positif
Fri Dec 02 05:46:48 +0000 2022,1598554252271812608,kasih contoh real time depo jenius line bank and more iseng doang aman koo ojk orang aplikasi jasa uang percaya,0,1,0,0,in,1508248304471085056,1598464469101076480,gapapakogpp,https://twitter.com/gapapakogpp/status/1598554252271812608,"['kasih', 'contoh', 'real', 'time', 'depo', 'jenius', 'line', 'bank', 'and', 'more', 'iseng', 'doang', 'aman', 'koo', 'ojk', 'orang', 'aplikasi', 'jasa', 'uang', 'percaya']",3,0,3,Positif
Fri Dec 02 03:16:11 +0000 2022,1598516348325617665,muncul tampil pilih new card simpan debit card jenius aplikasi dana klik visa jenius debit card cofwrmxqcue,0,1,0,0,in,1424275604002664450,1598513012796952576,hopeuarmys,https://twitter.com/hopeuarmys/status/1598516348325617665,"['muncul', 'tampil', 'pilih', 'new', 'card', 'simpan', 'debit', 'card', 'jenius', 'aplikasi', 'dana', 'klik', 'visa', 'jenius', 'debit', 'card', 'cofwrmxqcue']",2,1,1,Positif
Thu Dec 01 13:04:35 +0000 2022,1598302036327796736,jenius nama aplikasi,0,1,0,0,in,1013625484901380097,1597854038875574272,shuabeey,https://twitter.com/shuabeey/status/1598302036327796736,"['jenius', 'nama', 'aplikasi']",1,0,1,Positif
Thu Dec 01 10:55:25 +0000 2022,1598269533470756865,aplikasi jenius kah,0,1,0,0,in,921318289388707841,1598268191272501248,prozenpud,https://twitter.com/prozenpud/status/1598269533470756865,"['aplikasi', 'jenius', 'kah']",1,0,1,Positif
Thu Dec 01 09:35:43 +0000 2022,1598249472945197056,salah kak simpan kartu bank jenius aplikasi dana top up saldo dana kartu jenius,0,2,0,0,in,1063785245583921154,1598216949003350016,everypoet_ri,https://twitter.com/everypoet_ri/status/1598249472945197056,"['salah', 'kak', 'simpan', 'kartu', 'bank', 'jenius', 'aplikasi', 'dana', 'top', 'up', 'saldo', 'dana', 'kartu', 'jenius']",2,1,1,Positif
Mon Jan 30 12:30:23 +0000 2023,1620036702416015364,iya teman pakai jenius tidak tarik pakai aplikasi canggih bank negara indonesia mobile nama,1,2,0,0,in,1509085765275320320,1614914234323959809,Alayna_05,https://twitter.com/Alayna_05/status/1620036702416015364,"['iya', 'teman', 'pakai', 'jenius', 'tidak tarik', 'pakai', 'aplikasi', 'canggih', 'bank negara indonesia', 'mobile', 'nama']",1,0,1,Positif
Mon Jan 30 04:25:44 +0000 2023,1619914735587319810,min aplikasi jenius tidak bisa login conlokqtkgd,2,6,0,1,in,1194213888222326784,1619914735587319810,onlyforbk,https://twitter.com/onlyforbk/status/1619914735587319810,"['min', 'aplikasi', 'jenius', 'tidak bisa', 'login', 'conlokqtkgd']",1,1,0,Netral
Sun Jan 29 08:17:09 +0000 2023,1619610587226574848,coba bayar wifi pakai aplikasi jenius gampang banget langkahkecilhariini,0,0,0,0,in,1203211660036472833,1619610587226574848,amamiyy,https://twitter.com/amamiyy/status/1619610587226574848,"['coba', 'bayar', 'wifi', 'pakai', 'aplikasi', 'jenius', 'gampang', 'banget', 'langkahkecilhariini']",1,0,1,Positif
Sun Jan 29 06:39:02 +0000 2023,1619585893580562432,beli pulsa pakai aplikasi jenius auto langsung masuk langkahkecilhariini,0,0,0,0,in,1261217078490492928,1619585893580562432,puduchannie_,https://twitter.com/puduchannie_/status/1619585893580562432,"['beli', 'pulsa', 'pakai', 'aplikasi', 'jenius', 'auto', 'langsung', 'masuk', 'langkahkecilhariini']",1,0,1,Positif
Sat Jan 28 01:49:35 +0000 2023,1619150665938538499,mohon bantu akun jenius tidak aktif fisik kartu coba reset password aplikasi jenius hasil login masuk guna password otp pin logout tolong help terima kasih,1,3,0,0,in,78289738,1619150665938538499,taoefiq,https://twitter.com/taoefiq/status/1619150665938538499,"['mohon', 'bantu', 'akun', 'jenius', 'tidak aktif', 'fisik', 'kartu', 'coba', 'reset', 'password', 'aplikasi', 'jenius', 'hasil', 'login', 'masuk', 'guna', 'password', 'otp', 'pin', 'logout', 'tolong', 'help', 'terima kasih']",2,0,2,Positif
Fri Jan 27 14:08:40 +0000 2023,1618974274634780672,tidak bisa login aplikasi jenius gerangan,0,1,0,0,in,2433251756,1618974274634780672,saidmzaki,https://twitter.com/saidmzaki/status/1618974274634780672,"['tidak bisa', 'login', 'aplikasi', 'jenius', 'gerangan']",1,1,0,Netral
Fri Jan 27 11:57:31 +0000 2023,1618941269455306752,saldo flexy saver jenius aplikasi tidak bisa buka,0,0,0,0,in,1083441997464006656,1618941269455306752,thobivora,https://twitter.com/thobivora/status/1618941269455306752,"['saldo', 'flexy', 'saver', 'jenius', 'aplikasi', 'tidak bisa', 'buka']",1,1,0,Netral
Fri Jan 27 11:29:27 +0000 2023,1618934204443820033,jenius ganti handphone aplikasi jenius konek new handphone,1,1,0,0,in,1291621471,1618934204443820033,f_rahman777,https://twitter.com/f_rahman777/status/1618934204443820033,"['jenius', 'ganti', 'handphone', 'aplikasi', 'jenius', 'konek', 'new', 'handphone']",2,1,1,Positif
Fri Jan 27 08:10:19 +0000 2023,1618884093042900993,apes day cegat mbak mas jenius pas gue tolak mbak judes banget muka enggak anjing gue buru cari magang tawar aplikasi coqededkl,0,0,0,0,in,1352568741754621952,1618884093042900993,pshtrope,https://twitter.com/pshtrope/status/1618884093042900993,"['apes', 'day', 'cegat', 'mbak', 'mas', 'jenius', 'pas', 'gue', 'tolak', 'mbak', 'judes', 'banget', 'muka', 'enggak anjing', 'gue', 'buru', 'cari', 'magang', 'tawar', 'aplikasi', 'coqededkl']",2,1,1,Positif
Tue Jan 24 10:05:35 +0000 2023,1617825935432224772,sulit log in aplikasi jenius,0,2,0,0,in,64062115,1617825935432224772,ranggatrn,https://twitter.com/ranggatrn/status/1617825935432224772,"['sulit', 'log', 'in', 'aplikasi', 'jenius']",2,1,1,Positif
Sat Jan 21 00:34:33 +0000 2023,1616595065199296514,jenius oke segi aplikasi layan biaya adminnya ribu relatif mahal eike tutup akun,0,0,0,0,in,1576680277,1616456773950640131,ohbitnaa,https://twitter.com/ohbitnaa/status/1616595065199296514,"['jenius', 'oke', 'segi', 'aplikasi', 'layan', 'biaya', 'adminnya', 'ribu', 'relatif', 'mahal', 'eike', 'tutup', 'akun']",2,1,1,Positif
Thu Jan 19 05:06:54 +0000 2023,1615938828828835840,kak unlink device kak tidak bisa masuk aplikasi jenius kak,0,1,0,0,in,2823695480,1615938828828835840,Fairuz29Fz,https://twitter.com/Fairuz29Fz/status/1615938828828835840,"['kak', 'unlink', 'device', 'kak', 'tidak bisa', 'masuk', 'aplikasi', 'jenius', 'kak']",1,1,0,Netral
Tue Jan 17 10:49:48 +0000 2023,1615300347333087232,cabang langsung masalah jaring bank aneh tutup tidak bisa buka aplikasi email jenius masuk sok far tahun tidak ada info mudah tidak ada tagih biaya admin numouk,2,2,0,3,in,98599993,1319603864601935872,oSmaR_,https://twitter.com/oSmaR_/status/1615300347333087232,"['cabang', 'langsung', 'masalah', 'jaring', 'bank', 'aneh', 'tutup', 'tidak bisa', 'buka', 'aplikasi', 'email', 'jenius', 'masuk', 'sok', 'far', 'tahun', 'tidak ada', 'info', 'mudah', 'tidak ada', 'tagih', 'biaya', 'admin', 'numouk']",2,6,-4,Negatif
Sun Jan 15 02:32:06 +0000 2023,1614450323208409089,aplikasi jenius cha bank btpn,0,1,0,0,in,76953390,1614240464689065986,dova_hzkl,https://twitter.com/dova_hzkl/status/1614450323208409089,"['aplikasi', 'jenius', 'cha', 'bank', 'btpn']",1,0,1,Positif
Sat Jan 14 14:10:52 +0000 2023,1614263786244014081,ganti device rekan jenius offline registrasi aplikasi ulang,1,2,0,0,in,1325132796092841984,1614263786244014081,kennynuna,https://twitter.com/kennynuna/status/1614263786244014081,"['ganti', 'device', 'rekan', 'jenius', 'offline', 'registrasi', 'aplikasi', 'ulang']",1,2,-1,Negatif
Sat Jan 14 05:52:54 +0000 2023,1614138466744569857,hubung rekan jenius aplikasi ide berlian menit tutup tidak bantu,0,1,0,0,in,273858189,1614137817894092800,jansen_pangeran,https://twitter.com/jansen_pangeran/status/1614138466744569857,"['hubung', 'rekan', 'jenius', 'aplikasi', 'ide', 'berlian', 'menit', 'tutup', 'tidak bantu']",1,0,1,Positif
Sat Jan 14 03:19:18 +0000 2023,1614099810709307392,akun bank blu baca jenius akun bank pilih kartu blu baca daftar mudah aplikasi kartu jenius pakai visa harga ratenya murah mastercard,0,1,0,0,in,1613706474194358272,1614099805009215490,solusihircom,https://twitter.com/solusihircom/status/1614099810709307392,"['akun', 'bank', 'blu', 'baca', 'jenius', 'akun', 'bank', 'pilih', 'kartu', 'blu', 'baca', 'daftar', 'mudah', 'aplikasi', 'kartu', 'jenius', 'pakai', 'visa', 'harga', 'ratenya', 'murah', 'mastercard']",4,0,4,Positif
Fri Jan 13 09:32:42 +0000 2023,1613831395247525889,jenius akun bisnis jenius tidak bisa akses tap lihat cvv aplikasi please advise terima kasih,1,2,0,0,in,1256335195717828608,1613831395247525889,gbgskr,https://twitter.com/gbgskr/status/1613831395247525889,"['jenius', 'akun', 'bisnis', 'jenius', 'tidak bisa', 'akses', 'tap', 'lihat', 'cvv', 'aplikasi', 'please', 'advise', 'terima kasih']",2,1,1,Positif
Fri Jan 13 08:27:01 +0000 2023,1613814862274232326,service point jenius langsung proses pindah aplikasi handphone video call kota malang bisa mana lokasi,0,1,0,0,in,263755972,1613089795600961536,hendro_ps,https://twitter.com/hendro_ps/status/1613814862274232326,"['service', 'point', 'jenius', 'langsung', 'proses', 'pindah', 'aplikasi', 'handphone', 'video', 'call', 'kota', 'malang', 'bisa', 'mana', 'lokasi']",1,1,0,Netral
Thu Jan 12 11:43:21 +0000 2023,1613501883431387137,sahabat mohon maaf ketidaknyamanan alami kait jenius sila hubung jenius help email jeniushelp com twitter chat aplikasi terima kasih,0,1,0,0,in,2424890203,1613186268187480065,lifeatbtpn,https://twitter.com/lifeatbtpn/status/1613501883431387137,"['sahabat', 'mohon', 'maaf', 'ketidaknyamanan', 'alami', 'kait', 'jenius', 'sila', 'hubung', 'jenius', 'help', 'email', 'jeniushelp', 'com', 'twitter', 'chat', 'aplikasi', 'terima', 'kasih']",2,1,1,Positif
Thu Jan 12 11:39:05 +0000 2023,1613500813401546758,min xcard blokir permanen muncul kartu baru aplikasi telepon jenius help suruh nggu minggu nggu tidak ya cepat kirim xcard,0,1,0,0,in,235878640,1613500813401546758,Tetyaprynti,https://twitter.com/Tetyaprynti/status/1613500813401546758,"['min', 'xcard', 'blokir', 'permanen', 'muncul', 'kartu', 'baru', 'aplikasi', 'telepon', 'jenius', 'help', 'suruh', 'nggu', 'minggu', 'nggu', 'tidak ya', 'cepat', 'kirim', 'xcard']",2,1,1,Positif
Thu Jan 12 11:25:34 +0000 2023,1613497409585446914,telepon data seluler mati tutup telepon buka aplikasi jenius nge screenshoot catet something lupa telepon jenius tuju admin beda,0,0,0,0,in,1493606198322819073,1613466451754758144,BeBrightBetter,https://twitter.com/BeBrightBetter/status/1613497409585446914,"['telepon', 'data', 'seluler', 'mati', 'tutup', 'telepon', 'buka', 'aplikasi', 'jenius', 'nge', 'screenshoot', 'catet', 'something', 'lupa', 'telepon', 'jenius', 'tuju', 'admin', 'beda']",2,3,-1,Negatif
Thu Jan 12 09:40:04 +0000 2023,1613470858693038080,viral denda kurang dana aplikasi jenius guna lintah kapitalisme cotnnmmvbjg,0,0,0,0,in,4769568145,1613470858693038080,introvert_news,https://twitter.com/introvert_news/status/1613470858693038080,"['viral', 'denda', 'kurang', 'dana', 'aplikasi', 'jenius', 'guna', 'lintah', 'kapitalisme', 'cotnnmmvbjg']",1,2,-1,Negatif
Thu Jan 12 09:27:52 +0000 2023,1613467789469048832,viral denda kurang dana aplikasi jenius guna lintah kapitalisme coyjjjqvy,0,0,0,0,in,1056204313351974912,1613467789469048832,JonoHutagalung,https://twitter.com/JonoHutagalung/status/1613467789469048832,"['viral', 'denda', 'kurang', 'dana', 'aplikasi', 'jenius', 'guna', 'lintah', 'kapitalisme', 'coyjjjqvy']",1,2,-1,Negatif
Thu Jan 12 02:33:41 +0000 2023,1613363558842257412,install verifikasi tidak ada dana notifikasi gagal debit fee jenius aplikasi pasang,0,0,0,0,in,39949601,1613135995695935488,1590py,https://twitter.com/1590py/status/1613363558842257412,"['install', 'verifikasi', 'tidak ada', 'dana', 'notifikasi', 'gagal', 'debit', 'fee', 'jenius', 'aplikasi', 'pasang']",1,2,-1,Negatif
Thu Jan 12 02:14:02 +0000 2023,1613358611144790019,siap dana biaya langgan aplikasi ajar anak pajak biaya admin sisa kena kali denda brenti pakai jenius bayar langgan pakai gopay,0,0,0,0,in,848930755,1613135995695935488,sitititikoma,https://twitter.com/sitititikoma/status/1613358611144790019,"['siap', 'dana', 'biaya', 'langgan', 'aplikasi', 'ajar', 'anak', 'pajak', 'biaya', 'admin', 'sisa', 'kena', 'kali', 'denda', 'brenti', 'pakai', 'jenius', 'bayar', 'langgan', 'pakai', 'gopay']",2,1,1,Positif
Thu Jan 12 01:46:32 +0000 2023,1613351689821782016,transaksi beberpa identitas lengkap alamat kirim npwp masuk npwp jenius pokok data profil aplikasi jenius lengkap ditanyain,0,0,0,1,in,272210658,1613135995695935488,rizkyqidonk,https://twitter.com/rizkyqidonk/status/1613351689821782016,"['transaksi', 'beberpa', 'identitas', 'lengkap', 'alamat', 'kirim', 'npwp', 'masuk', 'npwp', 'jenius', 'pokok', 'data', 'profil', 'aplikasi', 'jenius', 'lengkap', 'ditanyain']",4,2,2,Positif
Wed Jan 11 21:08:18 +0000 2023,1613281671062917120,halo kak aplikasi jenius cek dibagain mana kak,0,0,0,0,in,1565438244,1590671416802021380,nijirosky,https://twitter.com/nijirosky/status/1613281671062917120,"['halo', 'kak', 'aplikasi', 'jenius', 'cek', 'dibagain', 'mana', 'kak']",1,0,1,Positif
Wed Jan 11 14:10:18 +0000 2023,1613176476991651845,serius bikin jenius tawar mbak diuninstall apknya rekening henti aplikasi tagih kayak tidak ya,0,10,0,29,in,1173379321,1613135995695935488,zzzum4,https://twitter.com/zzzum4/status/1613176476991651845,"['serius', 'bikin', 'jenius', 'tawar', 'mbak', 'diuninstall', 'apknya', 'rekening', 'henti', 'aplikasi', 'tagih', 'kayak', 'tidak ya']",2,0,2,Positif
Wed Jan 11 12:28:30 +0000 2023,1613150860951027714,bayar panjang langgan aplikasi kak duit kurang saya kena ribu ribu uang kurang kak syarat jenius minimal sisa saldo us transaksi tidak dikasihtau dikasihtau pas komplain,0,1,0,1,in,848930755,1613135995695935488,sitititikoma,https://twitter.com/sitititikoma/status/1613150860951027714,"['bayar', 'panjang', 'langgan', 'aplikasi', 'kak', 'duit', 'kurang saya', 'kena', 'ribu', 'ribu', 'uang', 'kurang kak', 'syarat', 'jenius', 'minimal', 'sisa', 'saldo', 'us', 'transaksi', 'tidak dikasihtau', 'dikasihtau', 'pas', 'komplain']",1,2,-1,Negatif
Mon Jan 09 14:50:02 +0000 2023,1612461700208545792,min unlink device telfon rekan mindahin aplikasi jenius telepon genggam telepon genggam ribet,0,1,0,0,in,216007115,1288755019118862336,achrozikin,https://twitter.com/achrozikin/status/1612461700208545792,"['min', 'unlink', 'device', 'telfon', 'rekan', 'mindahin', 'aplikasi', 'jenius', 'telepon genggam', 'telepon genggam', 'ribet']",1,1,0,Netral
Mon Jan 09 01:33:17 +0000 2023,1612261192193691648,bikin viralkan orang tidak pakai jenius aplikasi proses bukti bayar tidak bisa cek sistem kali bank kayak lucu,0,0,0,0,in,1376086114323165191,1611333037375254528,anitalena4,https://twitter.com/anitalena4/status/1612261192193691648,"['bikin', 'viralkan', 'orang', 'tidak pakai', 'jenius', 'aplikasi', 'proses', 'bukti', 'bayar', 'tidak bisa', 'cek', 'sistem', 'kali', 'bank', 'kayak', 'lucu']",2,1,1,Positif
Sat Jan 07 02:03:31 +0000 2023,1611544025051594752,syukur kartu kredit jenius cvv tidak cetak kartu fisik aplikasi jenius,0,0,0,0,in,139982550,1611524238644764673,KokoGiovanni,https://twitter.com/KokoGiovanni/status/1611544025051594752,"['syukur', 'kartu', 'kredit', 'jenius', 'cvv', 'tidak cetak', 'kartu', 'fisik', 'aplikasi', 'jenius']",3,0,3,Positif
Thu Jan 05 12:50:17 +0000 2023,1610982016497102848,kali jenius tidak pernah pakai bank coba make masuk aplikasi susah banget sesi memperpanjangin kartu cocjykphrc,0,3,0,0,in,773178832744423424,1610982016497102848,annkimjd,https://twitter.com/annkimjd/status/1610982016497102848,"['kali', 'jenius', 'tidak pernah', 'pakai', 'bank', 'coba', 'make', 'masuk', 'aplikasi', 'susah', 'banget', 'sesi', 'memperpanjangin', 'kartu', 'cocjykphrc']",1,2,-1,Negatif
Wed Jan 04 02:58:15 +0000 2023,1610470636731895808,mudah atur keuangankehidupan jenius unduh aplikasi jenius coubyyjnpf masuk cashtag sirzhain kolom referral,0,0,0,2,in,1431157597508300802,1610470636731895808,sirzhain,https://twitter.com/sirzhain/status/1610470636731895808,"['mudah', 'atur', 'keuangankehidupan', 'jenius', 'unduh', 'aplikasi', 'jenius', 'coubyyjnpf', 'masuk', 'cashtag', 'sirzhain', 'kolom', 'referral']",3,0,3,Positif
Mon Jan 02 10:45:09 +0000 2023,1609863358475558919,min aju ganti kartu by aplikasi jenius kirim kartu baru,1,3,0,0,in,393355054,1609863358475558919,fujan95,https://twitter.com/fujan95/status/1609863358475558919,"['min', 'aju', 'ganti', 'kartu', 'by', 'aplikasi', 'jenius', 'kirim', 'kartu', 'baru']",1,1,0,Netral
Sun Jan 01 15:38:59 +0000 2023,1609574917091229696,im maaf nautin debit jenius aplikasi dana gagal barangkali cotqgksekw,0,0,1,0,in,1570210662273658881,1609559638529429504,seringsendirian,https://twitter.com/seringsendirian/status/1609574917091229696,"['im', 'maaf', 'nautin', 'debit', 'jenius', 'aplikasi', 'dana', 'gagal', 'barangkali', 'cotqgksekw']",1,2,-1,Negatif
Mon Feb 27 15:19:10 +0000 2023,1630226040940564481,rekan jenius otot suruh baru diarahin buka aplikasi jenius pilih flexi cash pilih aju flexi cash tidak benar nasabah giring pinjam bilang tidak mau pinjam,0,1,0,0,in,1388470172915159042,1630226022045200385,Cocosaly1,https://twitter.com/Cocosaly1/status/1630226040940564481,"['rekan', 'jenius', 'otot', 'suruh', 'baru', 'diarahin', 'buka', 'aplikasi', 'jenius', 'pilih', 'flexi', 'cash', 'pilih', 'aju', 'flexi', 'cash', 'tidak benar', 'nasabah', 'giring', 'pinjam', 'bilang', 'tidak mau', 'pinjam']",2,1,1,Positif
Mon Feb 27 15:19:08 +0000 2023,1630226030903582722,rekan jenius bilang aplikasi fitur nama flexi cash fitur kait pinjam rekan lebar flexi cash,0,1,0,0,in,1388470172915159042,1630226022045200385,Cocosaly1,https://twitter.com/Cocosaly1/status/1630226030903582722,"['rekan', 'jenius', 'bilang', 'aplikasi', 'fitur', 'nama', 'flexi', 'cash', 'fitur', 'kait', 'pinjam', 'rekan', 'lebar', 'flexi', 'cash']",1,0,1,Positif
Mon Feb 27 15:19:07 +0000 2023,1630226024947654660,siang telepon jenius info fitur aplikasi sopan izin tidak terlalu sibuk bilang sila,0,1,0,0,in,1388470172915159042,1630226022045200385,Cocosaly1,https://twitter.com/Cocosaly1/status/1630226024947654660,"['siang', 'telepon', 'jenius', 'info', 'fitur', 'aplikasi', 'sopan', 'izin', 'tidak terlalu', 'sibuk', 'bilang', 'sila']",2,0,2,Positif
Sat Feb 25 07:47:42 +0000 2023,1629387646312263680,pakai beli reksadana atur keluar pakai fitur kantong deposito tmrw tabung kadang cari reward mission jenius tidak pakai aplikasi lambat lelah kontak mulu relationship managernya,0,2,0,2,in,66342158,1629307641754435586,nahdianurizzati,https://twitter.com/nahdianurizzati/status/1629387646312263680,"['pakai', 'beli', 'reksadana', 'atur', 'keluar', 'pakai', 'fitur', 'kantong', 'deposito', 'tmrw', 'tabung', 'kadang', 'cari', 'reward', 'mission', 'jenius', 'tidak pakai', 'aplikasi', 'lambat', 'lelah', 'kontak', 'mulu', 'relationship', 'managernya']",1,3,-2,Negatif
Thu Feb 23 05:22:22 +0000 2023,1628626295876894720,kemarin sadar kartu debit jenius hilang wkwk ambil cash minggu sadar kemarin pas maghrib langsung blokir permanen aplikasi auto kirim kartu ganti biaya ribu,0,1,0,0,in,852336452176273408,1628626295876894720,agoseriz,https://twitter.com/agoseriz/status/1628626295876894720,"['kemarin', 'sadar', 'kartu', 'debit', 'jenius', 'hilang', 'wkwk', 'ambil', 'cash', 'minggu', 'sadar', 'kemarin', 'pas', 'maghrib', 'langsung', 'blokir', 'permanen', 'aplikasi', 'auto', 'kirim', 'kartu', 'ganti', 'biaya', 'ribu']",1,3,-2,Negatif
Wed Feb 22 08:00:00 +0000 2023,1628303579000733696,bank btpn sosialisasi aplikasi jenius colcmfrpwso,0,0,0,0,in,891906384794599424,1628303579000733696,RADARSOLO_,https://twitter.com/RADARSOLO_/status/1628303579000733696,"['bank', 'btpn', 'sosialisasi', 'aplikasi', 'jenius', 'colcmfrpwso']",1,0,1,Positif
Wed Feb 22 03:03:16 +0000 2023,1628228905319698432,halo hapus perangkat aplikasi jenius lalu perpindaham device tidak bisa hapus via aplikasi bantu terima kasih,2,4,0,0,in,68444031,1628228905319698432,dantynvs,https://twitter.com/dantynvs/status/1628228905319698432,"['halo', 'hapus', 'perangkat', 'aplikasi', 'jenius', 'lalu', 'perpindaham', 'device', 'tidak bisa', 'hapus', 'via', 'aplikasi', 'bantu', 'terima', 'kasih']",1,1,0,Netral
Wed Feb 22 01:50:28 +0000 2023,1628210584998264832,bank btpn sosialisasi aplikasi jenius cojqyexqkax,0,0,0,0,in,2392460208,1628210584998264832,jawapos,https://twitter.com/jawapos/status/1628210584998264832,"['bank', 'btpn', 'sosialisasi', 'aplikasi', 'jenius', 'cojqyexqkax']",1,0,1,Positif
Tue Feb 21 23:55:56 +0000 2023,1628181759887278081,min unlink akun jenius ganti handphone telepon jenius langsung pilih menu unlink aplikasi jenius,2,6,0,0,in,962387912,1628181759887278081,daeguwangjanim,https://twitter.com/daeguwangjanim/status/1628181759887278081,"['min', 'unlink', 'akun', 'jenius', 'ganti', 'handphone', 'telepon', 'jenius', 'langsung', 'pilih', 'menu', 'unlink', 'aplikasi', 'jenius']",3,1,2,Positif
Tue Feb 21 05:30:00 +0000 2023,1627903442185506816,praktis mobile banking jenius laku transaksi uang aplikasi mudahpakaiprima,0,0,0,0,in,170666404,1627903442185506816,jaringanprima,https://twitter.com/jaringanprima/status/1627903442185506816,"['praktis', 'mobile', 'banking', 'jenius', 'laku', 'transaksi', 'uang', 'aplikasi', 'mudahpakaiprima']",1,0,1,Positif
Tue Feb 21 02:43:36 +0000 2023,1627861566094974976,halo top up bank negara indonesia tapcash aplikasi jenius saldo potong tidak ada saldo diupdate baru balance,10,23,0,1,in,67523443,1627861566094974976,asidoharo,https://twitter.com/asidoharo/status/1627861566094974976,"['halo', 'top up', 'bank negara indonesia', 'tapcash', 'aplikasi', 'jenius', 'saldo', 'potong', 'tidak ada', 'saldo', 'diupdate', 'baru', 'balance']",1,1,0,Netral
Mon Feb 20 03:59:03 +0000 2023,1627518166443368449,jenius aplikasi tidak bisa buka stuck diloading screen pas buka aplikasi lancar,1,2,0,0,in,287152229,1627518166443368449,bettercallvegi,https://twitter.com/bettercallvegi/status/1627518166443368449,"['jenius', 'aplikasi', 'tidak bisa', 'buka', 'stuck', 'diloading', 'screen', 'pas', 'buka', 'aplikasi', 'lancar']",2,2,0,Netral
Sun Feb 19 20:51:47 +0000 2023,1627410642599825409,pc install aplikasi xbox daftar akun daftar gamepass masuk metode bayar pakai jenius tinggal unduh game suka ratus game diinstall biaya ribu sewa game beli,0,1,0,2,in,78152444,1627264684452904960,randyrally,https://twitter.com/randyrally/status/1627410642599825409,"['pc', 'install', 'aplikasi', 'xbox', 'daftar', 'akun', 'daftar', 'gamepass', 'masuk', 'metode', 'bayar', 'pakai', 'jenius', 'tinggal', 'unduh', 'game', 'suka', 'ratus', 'game', 'diinstall', 'biaya', 'ribu', 'sewa', 'game', 'beli']",1,0,1,Positif
Fri Feb 17 22:19:17 +0000 2023,1626707888218705920,malas banget gombalin admin harap corkcicle gue makan rayu jenius aplikasi tabung sat set,0,0,0,0,in,1466898158361796608,1625338366068948993,Widyaik,https://twitter.com/Widyaik/status/1626707888218705920,"['malas', 'banget', 'gombalin', 'admin', 'harap', 'corkcicle', 'gue', 'makan', 'rayu', 'jenius', 'aplikasi', 'tabung', 'sat', 'set']",1,1,0,Netral
Fri Feb 17 04:00:17 +0000 2023,1626431314663718912,beritajabar jenius salur kredit rupiah miliar guna persen yoy aplikasijenius bankbtn coujnxrvy,0,0,0,0,in,79130206,1626431314663718912,jpnncom,https://twitter.com/jpnncom/status/1626431314663718912,"['beritajabar', 'jenius', 'salur', 'kredit', 'rupiah', 'miliar', 'guna', 'persen', 'yoy', 'aplikasijenius', 'bankbtn', 'coujnxrvy']",1,0,1,Positif
Wed Feb 15 10:31:42 +0000 2023,1625805042292002819,kakmin jenius tolong tidak ambil hati tinggal aplikasi jenius awokwokswk cobtqulsmn,1,2,0,1,in,2506539624,1625338366068948993,hhaijuli,https://twitter.com/hhaijuli/status/1625805042292002819,"['kakmin', 'jenius', 'tolong', 'tidak ambil', 'hati', 'tinggal', 'aplikasi', 'jenius', 'awokwokswk', 'cobtqulsmn']",3,0,3,Positif
Wed Feb 15 06:36:22 +0000 2023,1625745816655917056,alih langsung aplikasi shopeepay langsung bayar membership pakai shopeepay shopeepay currency usd by the way iklan buka jasa co weverse pakai jenius yen sung direct message cotanmssqb,0,1,0,0,in,370080288,1625745198402920448,jiminihere,https://twitter.com/jiminihere/status/1625745816655917056,"['alih', 'langsung', 'aplikasi', 'shopeepay', 'langsung', 'bayar', 'membership', 'pakai', 'shopeepay', 'shopeepay', 'currency', 'usd', 'by the way', 'iklan', 'buka', 'jasa', 'co', 'weverse', 'pakai', 'jenius', 'yen', 'sung', 'direct message', 'cotanmssqb']",1,0,1,Positif
