created_at,id_str,full_text,quote_count,reply_count,retweet_count,favorite_count,lang,user_id_str,conversation_id_str,username,tweet_url,token,positif,negatif,sentiment_score,sentiment
Mon Feb 14 02:41:29 +0000 2022,1493052749042237440,kartu expired tanggal februari kirim via aplikasi jenius tidak hasil dilirim rumah email suruh live chat live chat jyga reply,0,2,0,0,in,214043772,1493052749042237440,viennaochaa,https://twitter.com/viennaochaa/status/1493052749042237440,"['kartu', 'expired', 'tanggal', 'februari', 'kirim', 'via', 'aplikasi', 'jenius', 'tidak hasil', 'dilirim', 'rumah', 'email', 'suruh', 'live', 'chat', 'live', 'chat', 'jyga', 'reply']",1,0,1,Positif
Mon Feb 14 02:15:00 +0000 2022,1493046082686701568,guna aplikasi jenius kuat usaha sandang disabilitas hidup mandiri lengkap cowskwbkqr cosacchdtk,0,0,0,2,in,147889039,1493046082686701568,dompetdhuafaorg,https://twitter.com/dompetdhuafaorg/status/1493046082686701568,"['guna', 'aplikasi', 'jenius', 'kuat', 'usaha', 'sandang', 'disabilitas', 'hidup', 'mandiri', 'lengkap', 'cowskwbkqr', 'cosacchdtk']",3,1,2,Positif
Sun Feb 13 01:42:34 +0000 2022,1492675532089028610,aplikasi jenius lelet berat banget malas pakenya tidak satset kayak aplikasi livin mandiri,1,5,0,0,in,1048594345450864640,1492675532089028610,ujuhafiz,https://twitter.com/ujuhafiz/status/1492675532089028610,"['aplikasi', 'jenius', 'lelet', 'berat', 'banget', 'malas', 'pakenya', 'tidak satset', 'kayak', 'aplikasi', 'livin', 'mandiri']",1,2,-1,Negatif
Sat Feb 12 17:44:06 +0000 2022,1492555122668630016,jenius help milik rekening jenius tidak aktif alami kendala tidak dapat login aplikasi jenius coba reset pas hasil login timeout mohon bantu,0,1,0,0,in,1435533697,1492555122668630016,fajaria75,https://twitter.com/fajaria75/status/1492555122668630016,"['jenius', 'help', 'milik', 'rekening', 'jenius', 'tidak aktif', 'alami', 'kendala', 'tidak dapat', 'login', 'aplikasi', 'jenius', 'coba', 'reset', 'pas', 'hasil', 'login', 'timeout', 'mohon', 'bantu']",3,2,1,Positif
Sat Feb 12 14:36:43 +0000 2022,1492507969275133952,permisi min tumpang ganti nomor telepon aplikasi jenius on the spot,0,1,0,0,in,1246313353774915584,1491719818047012866,justaglimps3,https://twitter.com/justaglimps3/status/1492507969275133952,"['permisi', 'min', 'tumpang', 'ganti', 'nomor', 'telepon', 'aplikasi', 'jenius', 'on', 'the', 'spot']",1,1,0,Netral
Fri Feb 11 16:39:43 +0000 2022,1492176531309080578,mohon bantu tidak bisa masuk aplikasi jenius transfer rekening warning rekening tidak daftar covlwhjzpk,0,2,0,0,in,212409531,1492176531309080578,nolastname0202,https://twitter.com/nolastname0202/status/1492176531309080578,"['mohon', 'bantu', 'tidak bisa', 'masuk', 'aplikasi', 'jenius', 'transfer', 'rekening', 'warning', 'rekening', 'tidak daftar', 'covlwhjzpk']",1,1,0,Netral
Fri Feb 11 02:01:31 +0000 2022,1491955526686875648,jenius aplikasi kentang bangit anyinggg,0,0,0,0,in,1189294026932899840,1491955526686875648,asyiratu,https://twitter.com/asyiratu/status/1491955526686875648,"['jenius', 'aplikasi', 'kentang', 'bangit', 'anyinggg']",1,0,1,Positif
Fri Feb 11 01:39:55 +0000 2022,1491950093003485192,min jenius blokir tahu buka aplikasi transaksi atm,0,1,0,0,in,1409327465583964162,1491950093003485192,omegayllz,https://twitter.com/omegayllz/status/1491950093003485192,"['min', 'jenius', 'blokir', 'tahu', 'buka', 'aplikasi', 'transaksi', 'atm']",1,1,0,Netral
Thu Feb 10 00:36:19 +0000 2022,1491571695890534401,jenius keyboard oke tidak lot aplikasi asli pakai transfer cek saldo,0,1,0,0,in,3248489016,1491571695890534401,makmumnyajinu,https://twitter.com/makmumnyajinu/status/1491571695890534401,"['jenius', 'keyboard', 'oke', 'tidak lot', 'aplikasi', 'asli', 'pakai', 'transfer', 'cek', 'saldo']",3,0,3,Positif
Thu Feb 10 00:24:25 +0000 2022,1491568704387121154,aplikasi warna biru indodax twitter traveloka uang jenius paypal pedulilindungi binusmaya minutes keder,1,2,0,0,in,126924637,1491568704387121154,mdheanw,https://twitter.com/mdheanw/status/1491568704387121154,"['aplikasi', 'warna', 'biru', 'indodax', 'twitter', 'traveloka', 'uang', 'jenius', 'paypal', 'pedulilindungi', 'binusmaya', 'minutes', 'keder']",1,0,1,Positif
Wed Feb 09 10:36:46 +0000 2022,1491360418803359744,halo tidak hasil log in aplikasi kondisi telepon genggam difactory reset data hilang coba log in jenius sesi log in expired email password,0,1,0,0,in,3312633073,1491360418803359744,rainikuuu,https://twitter.com/rainikuuu/status/1491360418803359744,"['halo', 'tidak hasil', 'log', 'in', 'aplikasi', 'kondisi', 'telepon genggam', 'difactory', 'reset', 'data', 'hilang', 'coba', 'log', 'in', 'jenius', 'sesi', 'log', 'in', 'expired', 'email', 'password']",1,1,0,Netral
Wed Feb 09 10:05:18 +0000 2022,1491352500339113986,chat aplikasi kumpul kait jenius akses coxistyjkr terima kasih,0,0,0,0,in,2424890203,1490967714638471169,lifeatbtpn,https://twitter.com/lifeatbtpn/status/1491352500339113986,"['chat', 'aplikasi', 'kumpul', 'kait', 'jenius', 'akses', 'coxistyjkr', 'terima', 'kasih']",1,0,1,Positif
Wed Feb 09 10:05:10 +0000 2022,1491352466713354245,sahabat desak kait aplikasi jenius hubung jenius help email jeniushelp com twitter,0,1,0,0,in,2424890203,1490967714638471169,lifeatbtpn,https://twitter.com/lifeatbtpn/status/1491352466713354245,"['sahabat', 'desak', 'kait', 'aplikasi', 'jenius', 'hubung', 'jenius', 'help', 'email', 'jeniushelp', 'com', 'twitter']",2,0,2,Positif
Wed Feb 09 03:51:27 +0000 2022,1491258416039620608,transfer no dana rekening jenius alami gagal bukti transfer tidak keluar uang masuk uang jenius tarik bukti transfer dana aplikasi jenius,0,1,0,0,in,1444002708000628741,1491258416039620608,hoshitawhite,https://twitter.com/hoshitawhite/status/1491258416039620608,"['transfer', 'no', 'dana', 'rekening', 'jenius', 'alami', 'gagal', 'bukti', 'transfer', 'tidak keluar', 'uang', 'masuk', 'uang', 'jenius', 'tarik', 'bukti', 'transfer', 'dana', 'aplikasi', 'jenius']",3,1,2,Positif
Tue Feb 08 14:25:42 +0000 2022,1491055643633270787,unlink device jenius jenius mal telfon call center fiturnya aplikasi nonaktif hmmm,0,0,0,0,in,360526007,1491055643633270787,rifkiiaz,https://twitter.com/rifkiiaz/status/1491055643633270787,"['unlink', 'device', 'jenius', 'jenius', 'mal', 'telfon', 'call', 'center', 'fiturnya', 'aplikasi', 'nonaktif', 'hmmm']",2,0,2,Positif
Tue Feb 08 09:18:06 +0000 2022,1490978232614940674,sahabat desak kait aplikasi jenius hubung jenius help email jeniushelp com twitter chat aplikasi,0,1,0,0,in,2424890203,1490967714638471169,lifeatbtpn,https://twitter.com/lifeatbtpn/status/1490978232614940674,"['sahabat', 'desak', 'kait', 'aplikasi', 'jenius', 'hubung', 'jenius', 'help', 'email', 'jeniushelp', 'com', 'twitter', 'chat', 'aplikasi']",2,0,2,Positif
Tue Feb 08 08:29:35 +0000 2022,1490966024061341704,aplikasi jenius btpn beli produk reksadana lo praktis mudah sesuai profil risiko suka strategi dolar cost average cocok banget auto beli saldo aktif copoixkf,0,0,0,0,in,1067629987,1490966024061341704,sugarywednesday,https://twitter.com/sugarywednesday/status/1490966024061341704,"['aplikasi', 'jenius', 'btpn', 'beli', 'produk', 'reksadana', 'lo', 'praktis', 'mudah', 'sesuai', 'profil', 'risiko', 'suka', 'strategi', 'dolar', 'cost', 'average', 'cocok', 'banget', 'auto', 'beli', 'saldo', 'aktif', 'copoixkf']",3,1,2,Positif
Tue Feb 08 06:53:19 +0000 2022,1490941797128097799,desak kait aplikasi jenius hubung jenius help email jeniushelp com twitter chat aplikasi,0,1,0,0,in,2424890203,1490278592734842881,lifeatbtpn,https://twitter.com/lifeatbtpn/status/1490941797128097799,"['desak', 'kait', 'aplikasi', 'jenius', 'hubung', 'jenius', 'help', 'email', 'jeniushelp', 'com', 'twitter', 'chat', 'aplikasi']",2,0,2,Positif
Tue Feb 08 05:00:00 +0000 2022,1490913281497866241,kelola uang simpel tabung transaksi pintar aman aplikasi jenius mudahpakaiprima,0,0,0,1,in,170666404,1490913281497866241,jaringanprima,https://twitter.com/jaringanprima/status/1490913281497866241,"['kelola', 'uang', 'simpel', 'tabung', 'transaksi', 'pintar', 'aman', 'aplikasi', 'jenius', 'mudahpakaiprima']",3,0,3,Positif
Tue Feb 08 04:54:10 +0000 2022,1490911810618204162,telpon call center jenius menit menit suruh tunggu dengar lagu otomatis pulsa gue habis chat aplikasi tidak di balas balas aingkudu colqwjdjpfx,0,2,0,2,in,42810373,1490911810618204162,moncyl,https://twitter.com/moncyl/status/1490911810618204162,"['telpon', 'call', 'center', 'jenius', 'menit', 'menit', 'suruh', 'tunggu', 'dengar', 'lagu', 'otomatis', 'pulsa', 'gue', 'habis', 'chat', 'aplikasi', 'tidak di', 'balas', 'balas', 'aingkudu', 'colqwjdjpfx']",3,1,2,Positif
Mon Feb 07 15:08:39 +0000 2022,1490704064417615880,aplikasi jenius hasil uang modal daftar ojk coimjdapfbbp,0,0,0,0,in,1463466055880232963,1490704064417615880,Khalfani_co_id,https://twitter.com/Khalfani_co_id/status/1490704064417615880,"['aplikasi', 'jenius', 'hasil', 'uang', 'modal', 'daftar', 'ojk', 'coimjdapfbbp']",1,0,1,Positif
Mon Feb 07 11:38:36 +0000 2022,1490651202819813376,aplikasi jenius rilis fitur investasi guna coxcvutqk,0,0,1,0,in,118646322,1490651202819813376,Bisniscom,https://twitter.com/Bisniscom/status/1490651202819813376,"['aplikasi', 'jenius', 'rilis', 'fitur', 'investasi', 'guna', 'coxcvutqk']",1,0,1,Positif
Mon Feb 07 09:44:09 +0000 2022,1490622402996600832,min aplikasi jenius tidak bisa buka pemeliharankah belanja tokopedia tidak bisa bayar,0,1,0,0,in,56727671,1490622402996600832,vinahyngrum,https://twitter.com/vinahyngrum/status/1490622402996600832,"['min', 'aplikasi', 'jenius', 'tidak bisa', 'buka', 'pemeliharankah', 'belanja', 'tokopedia', 'tidak bisa', 'bayar']",1,2,-1,Negatif
Mon Feb 07 08:46:52 +0000 2022,1490607985324097542,halo kak ecek mutasi aplikasi jenius mutasi november kemarin terima kasih,0,1,0,0,in,2717010594,1490607985324097542,utatahco,https://twitter.com/utatahco/status/1490607985324097542,"['halo', 'kak', 'ecek', 'mutasi', 'aplikasi', 'jenius', 'mutasi', 'november', 'kemarin', 'terima', 'kasih']",1,0,1,Positif
Mon Feb 07 05:19:36 +0000 2022,1490555825445748739,daftar ojk cuan aplikasi hasil uang jenius modal aplikasipenghasiluang aplikasi jenius coypjnbytfp,0,0,0,0,in,103551225,1490555825445748739,tribunkaltim,https://twitter.com/tribunkaltim/status/1490555825445748739,"['daftar', 'ojk', 'cuan', 'aplikasi', 'hasil', 'uang', 'jenius', 'modal', 'aplikasipenghasiluang', 'aplikasi', 'jenius', 'coypjnbytfp']",2,0,2,Positif
Fri Feb 04 21:52:16 +0000 2022,1489718473722773504,mudah atur keuangankehidupan jenius unduh aplikasi jenius coohjpapttv masuk cashtag hamzah kolom referral,0,0,0,0,in,47048880,1489718473722773504,m_hamzah,https://twitter.com/m_hamzah/status/1489718473722773504,"['mudah', 'atur', 'keuangankehidupan', 'jenius', 'unduh', 'aplikasi', 'jenius', 'coohjpapttv', 'masuk', 'cashtag', 'hamzah', 'kolom', 'referral']",3,0,3,Positif
Fri Feb 04 15:04:35 +0000 2022,1489615876374417413,aplikasi jenius fitur investasi reksa dana coxbpmmthxy,0,0,0,1,in,118646322,1489615876374417413,Bisniscom,https://twitter.com/Bisniscom/status/1489615876374417413,"['aplikasi', 'jenius', 'fitur', 'investasi', 'reksa', 'dana', 'coxbpmmthxy']",1,0,1,Positif
Fri Feb 04 11:05:08 +0000 2022,1489555617228689411,mohon info gagal login aplikasi jenius ganti perangkat handphone di situ diberitahukan sesi log in login kode aktivasi,0,0,0,0,in,126573927,1489555617228689411,fitrah_se,https://twitter.com/fitrah_se/status/1489555617228689411,"['mohon', 'info', 'gagal', 'login', 'aplikasi', 'jenius', 'ganti', 'perangkat', 'handphone', 'di situ', 'diberitahukan', 'sesi', 'log', 'in', 'login', 'kode', 'aktivasi']",1,2,-1,Negatif
Fri Feb 04 08:59:03 +0000 2022,1489523886181867527,jenius pt bank btpn tbk pelopor digital banking indonesia luncur fitur baru investasi guna jenius investasi reksa dana mudah simpel langsung aplikasi jenius copkaycusk,0,0,0,0,in,1186946650595418116,1489523886181867527,voidotid,https://twitter.com/voidotid/status/1489523886181867527,"['jenius', 'pt', 'bank', 'btpn', 'tbk', 'pelopor', 'digital', 'banking', 'indonesia', 'luncur', 'fitur', 'baru', 'investasi', 'guna', 'jenius', 'investasi', 'reksa', 'dana', 'mudah', 'simpel', 'langsung', 'aplikasi', 'jenius', 'copkaycusk']",4,0,4,Positif
Thu Feb 03 11:40:00 +0000 2022,1489202002970099713,aplikasi jenius besut pt bank btpn tbk luncur fitur baru investasi guna jenius investasi reksa dana aplikasi uang jernihkanharapan cosjshwfe,0,0,1,2,in,23343960,1489202002970099713,kompascom,https://twitter.com/kompascom/status/1489202002970099713,"['aplikasi', 'jenius', 'besut', 'pt', 'bank', 'btpn', 'tbk', 'luncur', 'fitur', 'baru', 'investasi', 'guna', 'jenius', 'investasi', 'reksa', 'dana', 'aplikasi', 'uang', 'jernihkanharapan', 'cosjshwfe']",2,0,2,Positif
Thu Feb 03 11:12:33 +0000 2022,1489195095618248707,investasi reksa dana jenius rpribu aplikasi jenius hadir fitur investasi aplikasi bikin investasi mudah coymuccolej,0,0,1,0,in,184706308,1489195095618248707,FIMELAdotcom,https://twitter.com/FIMELAdotcom/status/1489195095618248707,"['investasi', 'reksa', 'dana', 'jenius', 'rpribu', 'aplikasi', 'jenius', 'hadir', 'fitur', 'investasi', 'aplikasi', 'bikin', 'investasi', 'mudah', 'coymuccolej']",3,0,3,Positif
Wed Feb 02 14:23:13 +0000 2022,1488880689667657730,halo kak tari tunai uang tidak keluar aplikasi jenius transaksi hasil,0,1,0,0,in,78190663,1488880689667657730,hediarizki,https://twitter.com/hediarizki/status/1488880689667657730,"['halo', 'kak', 'tari', 'tunai', 'uang', 'tidak keluar', 'aplikasi', 'jenius', 'transaksi', 'hasil']",1,0,1,Positif
Wed Feb 02 07:14:58 +0000 2022,1488772918909702146,selamat siang aktif aplikasi jenius device bank,2,1,0,0,in,4747824637,1488772918909702146,nanonao___,https://twitter.com/nanonao___/status/1488772918909702146,"['selamat', 'siang', 'aktif', 'aplikasi', 'jenius', 'device', 'bank']",2,0,2,Positif
Tue Feb 01 09:05:45 +0000 2022,1488438411404869632,reinstall aplikasi sebab kemarin bug jenius tidak bisa diakes,0,1,0,0,in,1370021418742603779,1488436225921142786,NalarPujangga,https://twitter.com/NalarPujangga/status/1488438411404869632,"['reinstall', 'aplikasi', 'sebab', 'kemarin', 'bug', 'jenius', 'tidak bisa', 'diakes']",1,2,-1,Negatif
Tue Feb 01 02:08:42 +0000 2022,1488333457373601804,peke tabung jenius btpn free charge aplikasi handphone,0,0,0,0,in,1322542259191963649,1488154328741265410,langityang7,https://twitter.com/langityang7/status/1488333457373601804,"['peke', 'tabung', 'jenius', 'btpn', 'free', 'charge', 'aplikasi', 'handphone']",1,0,1,Positif
Tue Mar 29 20:55:56 +0000 2022,1508910853089021952,halo bantu kemarin coba reset password aplikasi jenius tahap buat pin muncul notifikasi your session has expired are now logged out automatically kendala,1,1,0,0,in,1632328404,1508910853089021952,sidekiccck,https://twitter.com/sidekiccck/status/1508910853089021952,"['halo', 'bantu', 'kemarin', 'coba', 'reset', 'password', 'aplikasi', 'jenius', 'tahap', 'buat', 'pin', 'muncul', 'notifikasi', 'your', 'session', 'has', 'expired', 'are', 'now', 'logged', 'out', 'automatically', 'kendala']",1,1,0,Netral
Tue Mar 29 05:15:00 +0000 2022,1508674059583713281,aplikasi jenius dapat mudah transaksi uang atm pasti praktis laku langsung handphone mudahpakaiprima,0,0,0,1,in,170666404,1508674059583713281,jaringanprima,https://twitter.com/jaringanprima/status/1508674059583713281,"['aplikasi', 'jenius', 'dapat', 'mudah', 'transaksi', 'uang', 'atm', 'pasti', 'praktis', 'laku', 'langsung', 'handphone', 'mudahpakaiprima']",2,0,2,Positif
Tue Mar 29 04:59:53 +0000 2022,1508670257254498304,tawar jenius mbak suruh unduh aplikasi ya sudah tidak bisa unduh aplikasi memori penuh mbak iya pergi handphone memori penuh huhu,0,0,0,0,in,1126890703,1508670257254498304,sucisuc_,https://twitter.com/sucisuc_/status/1508670257254498304,"['tawar', 'jenius', 'mbak', 'suruh', 'unduh', 'aplikasi', 'ya sudah', 'tidak bisa', 'unduh', 'aplikasi', 'memori', 'penuh', 'mbak', 'iya', 'pergi', 'handphone', 'memori', 'penuh', 'huhu']",4,3,1,Positif
Mon Mar 28 01:15:31 +0000 2022,1508251403487412225,min tolong aplikasi jenius ringan,0,1,0,0,in,303197284,1508247502784385027,dewa_prnm,https://twitter.com/dewa_prnm/status/1508251403487412225,"['min', 'tolong', 'aplikasi', 'jenius', 'ringan']",2,0,2,Positif
Sat Mar 26 06:16:54 +0000 2022,1507602473368043526,aplikasi jenius handphone redmi aman aman lancar cepat handphone nokia lambat banget scan qr code banget,0,0,0,0,in,527080798,1507602473368043526,_covve_latte,https://twitter.com/_covve_latte/status/1507602473368043526,"['aplikasi', 'jenius', 'handphone', 'redmi', 'aman', 'aman', 'lancar', 'cepat', 'handphone', 'nokia', 'lambat', 'banget', 'scan', 'qr', 'code', 'banget']",5,2,3,Positif
Sat Mar 26 04:31:03 +0000 2022,1507575835053633537,kayak jenius secure aplikasi pakai device pindah device unlink device proses bikin kesal telfon rekan kasih link email sesi vidcall ambil foto pas vidcall,0,1,0,0,in,569458548,1507574818249486338,iamdenied,https://twitter.com/iamdenied/status/1507575835053633537,"['kayak', 'jenius', 'secure', 'aplikasi', 'pakai', 'device', 'pindah', 'device', 'unlink', 'device', 'proses', 'bikin', 'kesal', 'telfon', 'rekan', 'kasih', 'link', 'email', 'sesi', 'vidcall', 'ambil', 'foto', 'pas', 'vidcall']",1,1,0,Netral
Sat Mar 26 00:38:12 +0000 2022,1507517239687204866,selamat pagi ganti device coba login aplikasi jenius gagal mohon bantu,1,4,0,0,in,4345170252,1507517239687204866,rizkyrachmat211,https://twitter.com/rizkyrachmat211/status/1507517239687204866,"['selamat', 'pagi', 'ganti', 'device', 'coba', 'login', 'aplikasi', 'jenius', 'gagal', 'mohon', 'bantu']",2,2,0,Netral
Thu Apr 28 07:15:05 +0000 2022,1519575916498030592,bayar zakat mudah aplikasi digital perban jenius cocpsolhsvn,0,0,0,0,in,1430542109044477958,1519575916498030592,chatnews_id,https://twitter.com/chatnews_id/status/1519575916498030592,"['bayar', 'zakat', 'mudah', 'aplikasi', 'digital', 'perban', 'jenius', 'cocpsolhsvn']",2,0,2,Positif
Wed Apr 27 17:24:42 +0000 2022,1519366944914231297,hubung custom rom aplikasi uang kayak apps bank jalan trik apps perban kayak bank negara indonesia jenius jago gopay ovo dana jalan tidak ada cofepawrq,1,2,0,0,in,234733847,1519366871203516416,tokopedhiya,https://twitter.com/tokopedhiya/status/1519366944914231297,"['hubung', 'custom', 'rom', 'aplikasi', 'uang', 'kayak', 'apps', 'bank', 'jalan', 'trik', 'apps', 'perban', 'kayak', 'bank negara indonesia', 'jenius', 'jago', 'gopay', 'ovo', 'dana', 'jalan', 'tidak ada', 'cofepawrq']",1,1,0,Netral
Wed Apr 27 05:12:43 +0000 2022,1519182732227932161,gue tidak bisa jenius buka aplikasi rekening terima transfer rekening total menit,0,1,0,0,in,45860440,1519179528522067969,zakwanoe,https://twitter.com/zakwanoe/status/1519182732227932161,"['gue', 'tidak bisa', 'jenius', 'buka', 'aplikasi', 'rekening', 'terima', 'transfer', 'rekening', 'total', 'menit']",1,1,0,Netral
Wed Apr 27 05:04:33 +0000 2022,1519180679669751809,developer aplikasi jenius testing pakai handphone spesifikasi,0,0,0,0,in,45860440,1519179528522067969,zakwanoe,https://twitter.com/zakwanoe/status/1519180679669751809,"['developer', 'aplikasi', 'jenius', 'testing', 'pakai', 'handphone', 'spesifikasi']",1,0,1,Positif
Wed Apr 27 04:59:59 +0000 2022,1519179528522067969,bikin lomba adu cepat transfer guna aplikasi jenius,0,4,1,1,in,45860440,1519179528522067969,zakwanoe,https://twitter.com/zakwanoe/status/1519179528522067969,"['bikin', 'lomba', 'adu', 'cepat', 'transfer', 'guna', 'aplikasi', 'jenius']",2,0,2,Positif
Tue Apr 26 04:24:46 +0000 2022,1518808279744651264,saran aplikasi bantu khusus nama jenius help opsi chat rekan telepon internet,0,0,0,1,in,993479088932245504,1517789424657989633,albedowishes,https://twitter.com/albedowishes/status/1518808279744651264,"['saran', 'aplikasi', 'bantu', 'khusus', 'nama', 'jenius', 'help', 'opsi', 'chat', 'rekan', 'telepon', 'internet']",2,1,1,Positif
Mon Apr 25 08:50:15 +0000 2022,1518512703484030976,masya allah jenius aplikasi lambat,0,3,0,0,in,5652002,1518512703484030976,insanayu,https://twitter.com/insanayu/status/1518512703484030976,"['masya', 'allah', 'jenius', 'aplikasi', 'lambat']",1,1,0,Netral
Mon Apr 25 06:28:55 +0000 2022,1518477133076582400,jenius biaya admin gede banget aplikasi lambat parah bye maksimal,0,0,0,0,in,2281767199,1518477133076582400,roses_are_risa,https://twitter.com/roses_are_risa/status/1518477133076582400,"['jenius', 'biaya', 'admin', 'gede', 'banget', 'aplikasi', 'lambat', 'parah', 'bye', 'maksimal']",1,2,-1,Negatif
Mon Apr 25 04:56:45 +0000 2022,1518453939489832960,bilang jumat april senin april kerja tidak ada refundditerima rek terima hubung call center chat aplikasi jenius suruh tunggu doang masuk kocak banget tunggu kiamat tidak jelas prnanganannya,0,1,0,0,in,1129276009327484930,1517640447472021504,ksiezyxc,https://twitter.com/ksiezyxc/status/1518453939489832960,"['bilang', 'jumat', 'april', 'senin', 'april', 'kerja', 'tidak ada', 'refundditerima', 'rek', 'terima', 'hubung', 'call', 'center', 'chat', 'aplikasi', 'jenius', 'suruh', 'tunggu', 'doang', 'masuk', 'kocak', 'banget', 'tunggu', 'kiamat', 'tidak jelas', 'prnanganannya']",1,3,-2,Negatif
Mon Apr 25 01:44:59 +0000 2022,1518405679039455232,chat aplikasi kumpul kait jenius akses coxistgawj terima kasih,0,0,0,0,in,2424890203,1517640447472021504,lifeatbtpn,https://twitter.com/lifeatbtpn/status/1518405679039455232,"['chat', 'aplikasi', 'kumpul', 'kait', 'jenius', 'akses', 'coxistgawj', 'terima', 'kasih']",1,0,1,Positif
Sun Apr 24 03:22:37 +0000 2022,1518067862883422208,ari laso once lupa pokok bwain lagu msing byar royalti dhani jenius bidang musik vidioner parah sayang politik wkwk tolong aplikasi kayak spotify cafe,0,1,0,4,in,1036825453414121472,1517981150668464128,opokowe_krungu,https://twitter.com/opokowe_krungu/status/1518067862883422208,"['ari', 'laso', 'once', 'lupa', 'pokok', 'bwain', 'lagu', 'msing', 'byar', 'royalti', 'dhani', 'jenius', 'bidang', 'musik', 'vidioner', 'parah', 'sayang', 'politik', 'wkwk', 'tolong', 'aplikasi', 'kayak', 'spotify', 'cafe']",3,2,1,Positif
Sat Apr 23 14:00:09 +0000 2022,1517865916796907522,unduh jenius guna huawei langgan setia jenius ribet handphone paksa install jenius illegal handphone mohon jenius aplikasi jenius install perangkat huawei tidak ada google,0,0,0,0,in,397106910,1517865850279440385,c0mbra1n,https://twitter.com/c0mbra1n/status/1517865916796907522,"['unduh', 'jenius', 'guna', 'huawei', 'langgan', 'setia', 'jenius', 'ribet', 'handphone', 'paksa', 'install', 'jenius', 'illegal', 'handphone', 'mohon', 'jenius', 'aplikasi', 'jenius', 'install', 'perangkat', 'huawei', 'tidak ada', 'google']",6,3,3,Positif
Sat Apr 23 13:59:53 +0000 2022,1517865850279440385,mohon jenius tolong rilis aplikasi jenius toko aplikasi milik huawei huawei appgallery tahu huawei tidak bisa google mobile service alhasil handphone huawei tidak ada google play untu,0,1,0,0,in,397106910,1517865850279440385,c0mbra1n,https://twitter.com/c0mbra1n/status/1517865850279440385,"['mohon', 'jenius', 'tolong', 'rilis', 'aplikasi', 'jenius', 'toko', 'aplikasi', 'milik', 'huawei', 'huawei', 'appgallery', 'tahu', 'huawei', 'tidak bisa', 'google', 'mobile', 'service', 'alhasil', 'handphone', 'huawei', 'tidak ada', 'google', 'play', 'untu']",2,2,0,Netral
Fri Apr 22 20:47:33 +0000 2022,1517606054892564480,aplikasi jenius grup sopi,0,0,0,0,in,1363054783850946562,1517312231611895808,codemenu,https://twitter.com/codemenu/status/1517606054892564480,"['aplikasi', 'jenius', 'grup', 'sopi']",1,0,1,Positif
Fri Apr 22 14:10:23 +0000 2022,1517506101360861186,kemarin jenius error mulu barusan buka aplikasi tulis connection was interrupted coba pakai operator,0,1,0,0,in,4747824637,1517506101360861186,nanonao___,https://twitter.com/nanonao___/status/1517506101360861186,"['kemarin', 'jenius', 'error', 'mulu', 'barusan', 'buka', 'aplikasi', 'tulis', 'connection', 'was', 'interrupted', 'coba', 'pakai', 'operator']",1,0,1,Positif
Fri Apr 22 06:49:24 +0000 2022,1517395125046972416,biar tidak malu kartu jenius gue tolak mesin edc gue tarik dolar singapura beli mata uang sgd aplikasi jenius gara saldo sgdnya tidak hubung mcard tarik saldo rupiah rugi biaya administrasi ribu coqfbzblpj,0,0,0,0,in,227993143,1517395125046972416,rizkimuhadi,https://twitter.com/rizkimuhadi/status/1517395125046972416,"['biar', 'tidak malu', 'kartu', 'jenius', 'gue', 'tolak', 'mesin', 'edc', 'gue', 'tarik', 'dolar', 'singapura', 'beli', 'mata', 'uang', 'sgd', 'aplikasi', 'jenius', 'gara', 'saldo', 'sgdnya', 'tidak hubung', 'mcard', 'tarik', 'saldo', 'rupiah', 'rugi', 'biaya', 'administrasi', 'ribu', 'coqfbzblpj']",2,1,1,Positif
Fri Apr 22 04:30:27 +0000 2022,1517360158644482048,selamat siang hubung jenius help email jeniushelp com instagram twitter chat aplikasi kumpul kait jenius akses cohfjdfdt terima kasih,0,0,0,0,in,2424890203,1517346371216416768,lifeatbtpn,https://twitter.com/lifeatbtpn/status/1517360158644482048,"['selamat', 'siang', 'hubung', 'jenius', 'help', 'email', 'jeniushelp', 'com', 'instagram', 'twitter', 'chat', 'aplikasi', 'kumpul', 'kait', 'jenius', 'akses', 'cohfjdfdt', 'terima', 'kasih']",3,0,3,Positif
Fri Apr 22 02:22:00 +0000 2022,1517327831591976961,aplikasi mesti unlinked device ganti gadget jenius tidak ya,0,1,0,0,in,241937097,1517327831591976961,mIqballux,https://twitter.com/mIqballux/status/1517327831591976961,"['aplikasi', 'mesti', 'unlinked', 'device', 'ganti', 'gadget', 'jenius', 'tidak ya']",1,1,0,Netral
Thu Apr 21 16:57:34 +0000 2022,1517185790010601473,jenius jago paypal aplikasi percaya transfer mata uang asing pilih tolong strangers,0,0,0,0,in,72808729,1517185790010601473,BimaRadhitya,https://twitter.com/BimaRadhitya/status/1517185790010601473,"['jenius', 'jago', 'paypal', 'aplikasi', 'percaya', 'transfer', 'mata', 'uang', 'asing', 'pilih', 'tolong', 'strangers']",1,1,0,Netral
