created_at,id_str,full_text,quote_count,reply_count,retweet_count,favorite_count,lang,user_id_str,conversation_id_str,username,tweet_url,token,positif,negatif,sentiment_score,sentiment
Fri Aug 13 02:53:06 +0000 2021,1426013917059239940,min habis instal ulang aplikasi jenius susah masuk pas masuk pin langsung auto logout mulu,0,1,0,0,in,154133420,1426013917059239940,bagasardys,https://twitter.com/bagasardys/status/1426013917059239940,"['min', 'habis', 'instal', 'ulang', 'aplikasi', 'jenius', 'susah', 'masuk', 'pas', 'masuk', 'pin', 'langsung', 'auto', 'logout', 'mulu']",2,3,-1,Negatif
Fri Aug 13 02:48:21 +0000 2021,1426012721619750916,tidak bisa login aplikasi jenius tulis tulis otomatis klik akun masukib email kode otp tidak bisa solusi tolong,0,2,0,1,in,921265443217608704,1426012721619750916,m_aidilf00,https://twitter.com/m_aidilf00/status/1426012721619750916,"['tidak bisa', 'login', 'aplikasi', 'jenius', 'tulis', 'tulis', 'otomatis', 'klik', 'akun', 'masukib', 'email', 'kode', 'otp', 'tidak bisa', 'solusi', 'tolong']",1,3,-2,Negatif
Fri Aug 13 01:36:29 +0000 2021,1425994633998323714,selamat pagi bapakibu desak kait aplikasi jenius hubung jenius help email jeniushelp com twitter chat aplikasi,0,1,0,0,in,2424890203,1425844994435215360,lifeatbtpn,https://twitter.com/lifeatbtpn/status/1425994633998323714,"['selamat', 'pagi', 'bapakibu', 'desak', 'kait', 'aplikasi', 'jenius', 'hubung', 'jenius', 'help', 'email', 'jeniushelp', 'com', 'twitter', 'chat', 'aplikasi']",3,0,3,Positif
Thu Aug 12 19:30:32 +0000 2021,1425902539560480772,halo kak aplikasi jenius maintenance coba top up card saldo tidak ubah refund card saldo aktif tidak ada ubah terima kasih,0,1,0,0,in,1306523410487414785,1425902539560480772,upiki_,https://twitter.com/upiki_/status/1425902539560480772,"['halo', 'kak', 'aplikasi', 'jenius', 'maintenance', 'coba', 'top', 'up', 'card', 'saldo', 'tidak ubah', 'refund', 'card', 'saldo', 'aktif', 'tidak ada', 'ubah', 'terima kasih']",1,1,0,Netral
Thu Aug 12 13:26:44 +0000 2021,1425810988675207180,ih baca aplikasi kayak jenius blu by baca nama pindah apaya jenius lambat banget,0,0,0,0,in,3437050394,1425810988675207180,weirdniss,https://twitter.com/weirdniss/status/1425810988675207180,"['ih', 'baca', 'aplikasi', 'kayak', 'jenius', 'blu', 'by', 'baca', 'nama', 'pindah', 'apaya', 'jenius', 'lambat', 'banget']",2,2,0,Netral
Thu Aug 12 12:28:43 +0000 2021,1425796385757040641,wow aplikasi jenius baru oi fresh,0,1,0,0,in,97617326,1425796385757040641,ian_septians,https://twitter.com/ian_septians/status/1425796385757040641,"['wow', 'aplikasi', 'jenius', 'baru', 'oi', 'fresh']",2,0,2,Positif
Thu Aug 12 05:55:48 +0000 2021,1425697505358925827,all right sometimes pindahin uang saver top up refund makan tambah aplikasi jenius berat loadingnya lumayan singkat,0,1,0,0,in,883605472711909376,1425695595029688320,loverdotes,https://twitter.com/loverdotes/status/1425697505358925827,"['all', 'right', 'sometimes', 'pindahin', 'uang', 'saver', 'top up', 'refund', 'makan', 'tambah', 'aplikasi', 'jenius', 'berat', 'loadingnya', 'lumayan', 'singkat']",1,2,-1,Negatif
Thu Aug 12 00:35:17 +0000 2021,1425616844468088836,salam bang ditingkatin jenius aplikasi berat kadang maintenance bikin orang salah paham password pin salah pas lapor jenius maintenance doang bikin panik,0,0,0,0,in,114877015,1425596509593116678,farizalhan,https://twitter.com/farizalhan/status/1425616844468088836,"['salam', 'bang', 'ditingkatin', 'jenius', 'aplikasi', 'berat', 'kadang', 'maintenance', 'bikin', 'orang', 'salah', 'paham', 'password', 'pin', 'salah', 'pas', 'lapor', 'jenius', 'maintenance', 'doang', 'bikin', 'panik']",2,4,-2,Negatif
Wed Aug 11 16:12:06 +0000 2021,1425490217213992967,tampil aplikasi jenius,0,0,0,0,in,843314890190217216,1425490217213992967,tongtjilap,https://twitter.com/tongtjilap/status/1425490217213992967,"['tampil', 'aplikasi', 'jenius']",1,0,1,Positif
Wed Aug 11 14:22:27 +0000 2021,1425462619742167044,tanggal agt top up ribu shopee pay wallet center aplikasi jenius kupon shopee ribu direct message no jenius no shopee cek,0,1,0,0,in,748620666,1425462619742167044,alvinaltavista,https://twitter.com/alvinaltavista/status/1425462619742167044,"['tanggal', 'agt', 'top', 'up', 'ribu', 'shopee', 'pay', 'wallet', 'center', 'aplikasi', 'jenius', 'kupon', 'shopee', 'ribu', 'direct message', 'no', 'jenius', 'no', 'shopee', 'cek']",2,0,2,Positif
Wed Aug 11 09:37:48 +0000 2021,1425390988462202881,halo jenius kendala aplikasi jenius handphone hang kmdian log aplikasi jenius tidak bisa install ulang,0,1,0,0,in,265339878,1425390988462202881,myachmad,https://twitter.com/myachmad/status/1425390988462202881,"['halo', 'jenius', 'kendala', 'aplikasi', 'jenius', 'handphone', 'hang', 'kmdian', 'log', 'aplikasi', 'jenius', 'tidak bisa', 'install', 'ulang']",3,4,-1,Negatif
Wed Aug 11 09:04:05 +0000 2021,1425382502017900547,chat aplikasi lambat banget tidak ada level jenius ulang tahun,0,2,0,0,in,708725030931156992,1425293523700518916,bhejo80,https://twitter.com/bhejo80/status/1425382502017900547,"['chat', 'aplikasi', 'lambat', 'banget', 'tidak ada', 'level', 'jenius', 'ulang tahun']",1,2,-1,Negatif
Wed Aug 11 08:52:08 +0000 2021,1425379495754682380,min aplikasi jenius ringan,0,1,0,1,in,250520927,1425379495754682380,KukuhMujiono,https://twitter.com/KukuhMujiono/status/1425379495754682380,"['min', 'aplikasi', 'jenius', 'ringan']",2,0,2,Positif
Wed Aug 11 08:01:15 +0000 2021,1425366689445675010,baru aplikasi jenius menu investment tanda beli sbn ritel jenius coetsjpju,0,0,0,0,in,139982550,1425366689445675010,KokoGiovanni,https://twitter.com/KokoGiovanni/status/1425366689445675010,"['baru', 'aplikasi', 'jenius', 'menu', 'investment', 'tanda', 'beli', 'sbn', 'ritel', 'jenius', 'coetsjpju']",3,0,3,Positif
Wed Aug 11 06:54:25 +0000 2021,1425349871016370180,pakai jenius help aplikasi session expired min,0,1,0,0,in,128535494,1425278608319279110,ferdiansamulya,https://twitter.com/ferdiansamulya/status/1425349871016370180,"['pakai', 'jenius', 'help', 'aplikasi', 'session', 'expired', 'min']",1,0,1,Positif
Wed Aug 11 05:50:59 +0000 2021,1425333908795658249,aplikasi jenius ngeseliiinnnnn rekan kesal,0,0,0,0,in,4906244953,1425333908795658249,meritpurwanti,https://twitter.com/meritpurwanti/status/1425333908795658249,"['aplikasi', 'jenius', 'ngeseliiinnnnn', 'rekan', 'kesal']",1,1,0,Netral
Wed Aug 11 05:38:30 +0000 2021,1425330766242713600,aplikasi jenius tidak bisa pakai handphone,0,1,0,0,in,61127269,1425286630399643650,ngurahbas,https://twitter.com/ngurahbas/status/1425330766242713600,"['aplikasi', 'jenius', 'tidak bisa', 'pakai', 'handphone']",1,1,0,Netral
Wed Aug 11 03:22:03 +0000 2021,1425296427769503749,jenius help aplikasi tidak ada csnyasaya asa trnasaksi gagal saldo potong jenius,0,1,0,0,in,32933836,1425296427769503749,calliesta,https://twitter.com/calliesta/status/1425296427769503749,"['jenius', 'help', 'aplikasi', 'tidak ada', 'csnyasaya', 'asa', 'trnasaksi', 'gagal', 'saldo', 'potong', 'jenius']",2,2,0,Netral
Wed Aug 11 03:15:54 +0000 2021,1425294877953171456,he aplikasi jenius paynya tidak bisa pakai bayar tagih ganti pakai wifi rumah internet handphone dapat error cozkhyyrtmfd,0,1,0,0,in,418922152,1425294877953171456,asch998,https://twitter.com/asch998/status/1425294877953171456,"['he', 'aplikasi', 'jenius', 'paynya', 'tidak bisa', 'pakai', 'bayar', 'tagih', 'ganti', 'pakai', 'wifi', 'rumah', 'internet', 'handphone', 'dapat', 'error', 'cozkhyyrtmfd']",1,2,-1,Negatif
Tue Aug 10 23:00:47 +0000 2021,1425230677482479616,halo login akun jenius transaks aplikasi logout otomatis web tidak bisa login,0,1,0,0,in,1168513550576340993,1425230677482479616,daniel_hs20,https://twitter.com/daniel_hs20/status/1425230677482479616,"['halo', 'login', 'akun', 'jenius', 'transaks', 'aplikasi', 'logout', 'otomatis', 'web', 'tidak bisa', 'login']",1,1,0,Netral
Tue Aug 10 09:00:01 +0000 2021,1425019090431737857,bijak atur transaksi pangkal uang sehat aplikasi jenius butuh transaksi perban kelola gampang aman mudahpakaiprima,0,0,0,2,in,170666404,1425019090431737857,jaringanprima,https://twitter.com/jaringanprima/status/1425019090431737857,"['bijak', 'atur', 'transaksi', 'pangkal', 'uang', 'sehat', 'aplikasi', 'jenius', 'butuh', 'transaksi', 'perban', 'kelola', 'gampang', 'aman', 'mudahpakaiprima']",4,0,4,Positif
Tue Aug 10 08:43:17 +0000 2021,1425014878029287427,tutup akun jenius gara unlink device bank digital install ulang aplikasi repot banget layan jelek efek luas banding cerita rekening nasabah bobol,1,1,0,0,in,76713446,1425014878029287427,_fajarprasetyo,https://twitter.com/_fajarprasetyo/status/1425014878029287427,"['tutup', 'akun', 'jenius', 'gara', 'unlink', 'device', 'bank', 'digital', 'install', 'ulang', 'aplikasi', 'repot', 'banget', 'layan', 'jelek', 'efek', 'luas', 'banding', 'cerita', 'rekening', 'nasabah', 'bobol']",2,3,-1,Negatif
Tue Aug 10 06:33:43 +0000 2021,1424982275310059522,aplikasi jenius lelet masuk kode puter tidak masuk dashboard,0,1,0,0,in,70897231,1424982275310059522,boughil,https://twitter.com/boughil/status/1424982275310059522,"['aplikasi', 'jenius', 'lelet', 'masuk', 'kode', 'puter', 'tidak masuk', 'dashboard']",1,1,0,Netral
Tue Aug 10 04:51:18 +0000 2021,1424956498656956420,halo login akun jenius transaks aplikasi logout otomatis web tidak bisa login,0,0,0,0,in,1168513550576340993,1424956498656956420,daniel_hs20,https://twitter.com/daniel_hs20/status/1424956498656956420,"['halo', 'login', 'akun', 'jenius', 'transaks', 'aplikasi', 'logout', 'otomatis', 'web', 'tidak bisa', 'login']",1,1,0,Netral
Mon Aug 09 23:30:20 +0000 2021,1424875726176538625,jenius kartu atm hilang proses masuk aplikasi tidak bisa,0,1,0,0,in,69666631,1424875726176538625,nink079,https://twitter.com/nink079/status/1424875726176538625,"['jenius', 'kartu', 'atm', 'hilang', 'proses', 'masuk', 'aplikasi', 'tidak bisa']",1,2,-1,Negatif
Mon Aug 09 23:05:33 +0000 2021,1424869486713204736,cegah bobol dana btpn laku sesuai fitur aplikasi jenius cojbzqcvjw,0,0,0,0,in,118646322,1424869486713204736,Bisniscom,https://twitter.com/Bisniscom/status/1424869486713204736,"['cegah', 'bobol', 'dana', 'btpn', 'laku', 'sesuai', 'fitur', 'aplikasi', 'jenius', 'cojbzqcvjw']",1,0,1,Positif
Mon Aug 09 15:04:38 +0000 2021,1424748463359545358,aplikasi jenius maintenance min,0,1,0,0,in,238837381,1424748463359545358,m_heru_din,https://twitter.com/m_heru_din/status/1424748463359545358,"['aplikasi', 'jenius', 'maintenance', 'min']",1,0,1,Positif
Mon Aug 09 12:10:50 +0000 2021,1424704723014144006,lihat bar nguntal cto aplikasi gate foundation qa jeniusikea port moresby lalala utas kronik ribut haha convmwzsgx,0,0,1,0,in,46984101,1410781803296690179,uradn,https://twitter.com/uradn/status/1424704723014144006,"['lihat', 'bar', 'nguntal', 'cto', 'aplikasi', 'gate', 'foundation', 'qa', 'jeniusikea', 'port', 'moresby', 'lalala', 'utas', 'kronik', 'ribut', 'haha', 'convmwzsgx']",0,1,-1,Negatif
Mon Aug 09 11:35:50 +0000 2021,1424695913491013642,bank btpn pondok indah balas email login aplikasi jenius kenyataanya tidak bisa login mohon bantu,0,1,0,0,in,520540348,1424695913491013642,Mrudinhartono7,https://twitter.com/Mrudinhartono7/status/1424695913491013642,"['bank', 'btpn', 'pondok', 'indah', 'balas', 'email', 'login', 'aplikasi', 'jenius', 'kenyataanya', 'tidak bisa', 'login', 'mohon', 'bantu']",2,1,1,Positif
Mon Aug 09 11:11:23 +0000 2021,1424689761503965187,hapus device reset ulang hapus perangkat tidak bisa masuk aplikasi jenius bantu,0,0,0,0,in,2283737015,1424209566783315971,Ian_Alpiansyah,https://twitter.com/Ian_Alpiansyah/status/1424689761503965187,"['hapus', 'device', 'reset', 'ulang', 'hapus', 'perangkat', 'tidak bisa', 'masuk', 'aplikasi', 'jenius', 'bantu']",1,2,-1,Negatif
Sun Aug 08 08:12:01 +0000 2021,1424282237273395200,tidak bisa login aplikasi jenius pakai perangkat sesi log out otomatis tidak bisa login,0,1,0,2,in,973167952500482049,1419201383610257412,Rossi4658461346,https://twitter.com/Rossi4658461346/status/1424282237273395200,"['tidak bisa', 'login', 'aplikasi', 'jenius', 'pakai', 'perangkat', 'sesi', 'log', 'out', 'otomatis', 'tidak bisa', 'login']",1,2,-1,Negatif
Sun Aug 08 07:59:46 +0000 2021,1424279154212495366,malam tidak bisa sign in aplikasi jenius install ulang baru tidak bisa aduh aman,0,1,0,0,in,40827409,1424279154212495366,rimbostar,https://twitter.com/rimbostar/status/1424279154212495366,"['malam', 'tidak bisa', 'sign', 'in', 'aplikasi', 'jenius', 'install', 'ulang', 'baru', 'tidak bisa', 'aduh', 'aman']",2,4,-2,Negatif
Sun Aug 08 01:39:41 +0000 2021,1424183502702977027,min transaksi pulsa tokopedia jeniuspay transaksi gagal saldo kurang tidak bisa masuk aplikasi jenius koneksi putus tolong urgent cofhfqplov,0,1,0,0,in,62466261,1424183502702977027,mondenella,https://twitter.com/mondenella/status/1424183502702977027,"['min', 'transaksi', 'pulsa', 'tokopedia', 'jeniuspay', 'transaksi', 'gagal', 'saldo', 'kurang', 'tidak bisa', 'masuk', 'aplikasi', 'jenius', 'koneksi', 'putus', 'tolong', 'urgent', 'cofhfqplov']",1,4,-3,Negatif
Sun Aug 08 01:05:01 +0000 2021,1424174775723716617,bobol rekening modus tipu timpa nasabah jenius btpn colhezgzco install aplikasi kumpar baca nyaman iklan ganggu copcdieutt,0,0,0,0,in,2307189362,1424174775723716617,ffahmifaishal,https://twitter.com/ffahmifaishal/status/1424174775723716617,"['bobol', 'rekening', 'modus', 'tipu', 'timpa', 'nasabah', 'jenius', 'btpn', 'colhezgzco', 'install', 'aplikasi', 'kumpar', 'baca', 'nyaman', 'iklan', 'ganggu', 'copcdieutt']",2,1,1,Positif
Sat Aug 07 23:34:21 +0000 2021,1424151959720714242,begin dear jenius hari tidak bisa login aplikasi alas salah password salah nama guna ujung forget reset password session exp log out automatically,0,1,0,0,in,1077792408845205504,1424151959720714242,hokaidoooo,https://twitter.com/hokaidoooo/status/1424151959720714242,"['begin', 'dear', 'jenius', 'hari', 'tidak bisa', 'login', 'aplikasi', 'alas', 'salah', 'password', 'salah', 'nama guna', 'ujung', 'forget', 'reset', 'password', 'session', 'exp', 'log', 'out', 'automatically']",1,3,-2,Negatif
Sat Aug 07 14:39:40 +0000 2021,1424017402723934208,halo admin tidak bisa akses aplikasi jenius terang pin salah sesuai koneksi putus jaring internet bagus mohon bantu,0,0,0,0,in,1137401986620387328,1424017402723934208,ggoneluv,https://twitter.com/ggoneluv/status/1424017402723934208,"['halo', 'admin', 'tidak bisa', 'akses', 'aplikasi', 'jenius', 'terang', 'pin', 'salah', 'sesuai', 'koneksi', 'putus', 'jaring', 'internet', 'bagus', 'mohon', 'bantu']",3,3,0,Netral
Sat Aug 07 14:39:10 +0000 2021,1424017276924166144,halo admin tidak bisa akses aplikasi jenius terang pin salah sesuai koneksi putus jaring internet bagus mohon bantu,0,1,0,0,in,1137401986620387328,1424017276924166144,ggoneluv,https://twitter.com/ggoneluv/status/1424017276924166144,"['halo', 'admin', 'tidak bisa', 'akses', 'aplikasi', 'jenius', 'terang', 'pin', 'salah', 'sesuai', 'koneksi', 'putus', 'jaring', 'internet', 'bagus', 'mohon', 'bantu']",3,3,0,Netral
Sat Aug 07 14:34:58 +0000 2021,1424016221607849986,kak depan jenius baru cegah ulang kesal kak aplikasi jual tidak bisa transaksi gara aplikasi maintenance,0,0,0,1,in,765699501390606336,1424008884969099268,RizkyPA_Hero,https://twitter.com/RizkyPA_Hero/status/1424016221607849986,"['kak', 'depan', 'jenius', 'baru', 'cegah', 'ulang', 'kesal', 'kak', 'aplikasi', 'jual', 'tidak bisa', 'transaksi', 'gara', 'aplikasi', 'maintenance']",1,3,-2,Negatif
Sat Aug 07 04:35:41 +0000 2021,1423865406758871042,benar aplikasi jenius web tingkat interface bikin versi down,0,3,0,4,in,1077792408845205504,1423618100012847114,hokaidoooo,https://twitter.com/hokaidoooo/status/1423865406758871042,"['benar', 'aplikasi', 'jenius', 'web', 'tingkat', 'interface', 'bikin', 'versi', 'down']",2,0,2,Positif
Sat Aug 07 03:33:40 +0000 2021,1423849798667411457,unduh aplikasi jenius masuk kode saya nikmat layan prioritas prima saya prioritas lebihberarti digitalizingyourpriority,0,1,0,0,in,2424890203,1423849792870883331,lifeatbtpn,https://twitter.com/lifeatbtpn/status/1423849798667411457,"['unduh', 'aplikasi', 'jenius', 'masuk', 'kode', 'saya', 'nikmat', 'layan', 'prioritas', 'prima', 'saya', 'prioritas', 'lebihberarti', 'digitalizingyourpriority']",2,0,2,Positif
Sat Aug 07 03:33:39 +0000 2021,1423849792870883331,mudah investasi aplikasi saya prioritas layan prioritas akses mudah digital aplikasi jenius coffhnmozv,0,2,0,1,in,2424890203,1423849792870883331,lifeatbtpn,https://twitter.com/lifeatbtpn/status/1423849792870883331,"['mudah', 'investasi', 'aplikasi', 'saya', 'prioritas', 'layan', 'prioritas', 'akses', 'mudah', 'digital', 'aplikasi', 'jenius', 'coffhnmozv']",3,0,3,Positif
Sat Aug 07 02:22:12 +0000 2021,1423831814104252424,transaksi aplikasi drmana berjamjam enggak bisa login login loading dashboardnya isi gopay tidak loading loading aplikasi lancar jaya solusi hambat banget gara gara jenius rugi,0,1,0,0,in,109755493,1423827070807810049,mediocranky,https://twitter.com/mediocranky/status/1423831814104252424,"['transaksi', 'aplikasi', 'drmana', 'berjamjam', 'enggak bisa', 'login', 'login', 'loading', 'dashboardnya', 'isi', 'gopay', 'tidak loading', 'loading', 'aplikasi', 'lancar', 'jaya', 'solusi', 'hambat', 'banget', 'gara gara', 'jenius', 'rugi']",2,1,1,Positif
Fri Aug 06 18:26:23 +0000 2021,1423712071401701383,halo min login jenius device tidak bisa pin aplikasi langsung logout device muncul notifikasi gagal login,0,1,0,0,in,175049521,1423712071401701383,ramamyid,https://twitter.com/ramamyid/status/1423712071401701383,"['halo', 'min', 'login', 'jenius', 'device', 'tidak bisa', 'pin', 'aplikasi', 'langsung', 'logout', 'device', 'muncul', 'notifikasi', 'gagal', 'login']",1,2,-1,Negatif
Fri Aug 06 17:22:29 +0000 2021,1423695988812746761,mudah atur keuangankehidupan jenius unduh aplikasi jenius cotfaanzgpg masuk cashtag rizkisaputra kolom referral,0,0,0,0,in,225592657,1423695988812746761,rizkisaputra300,https://twitter.com/rizkisaputra300/status/1423695988812746761,"['mudah', 'atur', 'keuangankehidupan', 'jenius', 'unduh', 'aplikasi', 'jenius', 'cotfaanzgpg', 'masuk', 'cashtag', 'rizkisaputra', 'kolom', 'referral']",3,0,3,Positif
Fri Aug 06 12:24:04 +0000 2021,1423620889346658309,punten aplikasi jenius masalah tidak bisa log in tidak tanggap pindah bank jago bodoh,0,1,0,0,in,75434339,1423244202117242881,mazdakosongdua,https://twitter.com/mazdakosongdua/status/1423620889346658309,"['punten', 'aplikasi', 'jenius', 'masalah', 'tidak bisa', 'log', 'in', 'tidak tanggap', 'pindah', 'bank', 'jago', 'bodoh']",1,3,-2,Negatif
Fri Aug 06 09:29:21 +0000 2021,1423576922374623232,kak tidak ada balas jenius agent aplikasi,0,1,0,0,in,1093555827133145088,1423574629117956097,twentyandsad,https://twitter.com/twentyandsad/status/1423576922374623232,"['kak', 'tidak ada', 'balas', 'jenius', 'agent', 'aplikasi']",1,1,0,Netral
Fri Aug 06 09:22:03 +0000 2021,1423575084636139528,hubung jenius jenius help aplikasi scuffed jenius agent tidak ada reply menit,0,0,0,0,in,1093555827133145088,1423574629117956097,twentyandsad,https://twitter.com/twentyandsad/status/1423575084636139528,"['hubung', 'jenius', 'jenius', 'help', 'aplikasi', 'scuffed', 'jenius', 'agent', 'tidak ada', 'reply', 'menit']",3,1,2,Positif
Fri Aug 06 07:19:38 +0000 2021,1423544275048878081,gue tidak bisa login jenius desktop aplikasi hate technology hate mbanking hate this,0,1,0,1,in,548037203,1423544275048878081,catdya,https://twitter.com/catdya/status/1423544275048878081,"['gue', 'tidak bisa', 'login', 'jenius', 'desktop', 'aplikasi', 'hate', 'technology', 'hate', 'mbanking', 'hate', 'this']",1,1,0,Netral
Fri Aug 06 06:22:00 +0000 2021,1423529772907331587,mudah atur keuangankehidupan jenius unduh aplikasi jenius coiqjmqvf masuk cashtag nuhakaa kolom referral,0,0,0,0,in,1332229102925877248,1423529772907331587,myhorcruxe,https://twitter.com/myhorcruxe/status/1423529772907331587,"['mudah', 'atur', 'keuangankehidupan', 'jenius', 'unduh', 'aplikasi', 'jenius', 'coiqjmqvf', 'masuk', 'cashtag', 'nuhakaa', 'kolom', 'referral']",3,0,3,Positif
Fri Aug 06 01:08:43 +0000 2021,1423450931207630862,sms jenius maksud guna aplikasi jenius cogwukoyw,0,2,0,1,in,2382180691,1423450931207630862,LeilaFatmasari,https://twitter.com/LeilaFatmasari/status/1423450931207630862,"['sms', 'jenius', 'maksud', 'guna', 'aplikasi', 'jenius', 'cogwukoyw']",2,0,2,Positif
Thu Aug 05 13:39:13 +0000 2021,1423277413492944901,coba tolong benar jenius pay payment di atas juta error maaf something salah please try again later aplikasi uptodate tidak bisa,0,1,0,0,in,25174172,1423277413492944901,suryaadtmaja,https://twitter.com/suryaadtmaja/status/1423277413492944901,"['coba', 'tolong', 'benar', 'jenius', 'pay', 'payment', 'di atas', 'juta', 'error', 'maaf', 'something', 'salah', 'please', 'try', 'again', 'later', 'aplikasi', 'uptodate', 'tidak bisa']",2,3,-1,Negatif
Thu Aug 05 12:43:18 +0000 2021,1423263341359685633,login aplikasi tidak bisa buka jenius digital website pelihara minggu tolong info,0,0,0,0,in,411336035,1423263341359685633,Noovitaaaaa,https://twitter.com/Noovitaaaaa/status/1423263341359685633,"['login', 'aplikasi', 'tidak bisa', 'buka', 'jenius', 'digital', 'website', 'pelihara', 'minggu', 'tolong', 'info']",1,1,0,Netral
Thu Aug 05 10:11:11 +0000 2021,1423225062203695106,min jenius lambat banget buka aplikasi tidak lot buka jenius coqdpswvxog,0,1,0,0,in,885665780,1423225062203695106,astridgege,https://twitter.com/astridgege/status/1423225062203695106,"['min', 'jenius', 'lambat', 'banget', 'buka', 'aplikasi', 'tidak lot', 'buka', 'jenius', 'coqdpswvxog']",2,1,1,Positif
Thu Aug 05 02:46:59 +0000 2021,1423113273868652544,selamat pagi doni desak kait aplikasi jenius hubung jenius help email jeniushelp com twitter chat aplikasi,0,1,0,0,in,2424890203,1422878033384394752,lifeatbtpn,https://twitter.com/lifeatbtpn/status/1423113273868652544,"['selamat', 'pagi', 'doni', 'desak', 'kait', 'aplikasi', 'jenius', 'hubung', 'jenius', 'help', 'email', 'jeniushelp', 'com', 'twitter', 'chat', 'aplikasi']",3,0,3,Positif
Thu Aug 05 00:48:09 +0000 2021,1423083370834059267,moga free kayak jenius rekening jenius be metutup rge dadine sing nyidaang login aplikasi,0,1,0,0,in,99006980,1422777927540826113,veryltanaka,https://twitter.com/veryltanaka/status/1423083370834059267,"['moga', 'free', 'kayak', 'jenius', 'rekening', 'jenius', 'be', 'metutup', 'rge', 'dadine', 'sing', 'nyidaang', 'login', 'aplikasi']",2,0,2,Positif
Wed Aug 04 17:32:31 +0000 2021,1422973738937503746,halo min hilang handphone aplikasi banking jenius reset password login handphone beda email daftar jenius btpn gagal login coilehaimk,0,2,0,0,in,955828194589863936,1422973738937503746,midanusaibah,https://twitter.com/midanusaibah/status/1422973738937503746,"['halo', 'min', 'hilang', 'handphone', 'aplikasi', 'banking', 'jenius', 'reset', 'password', 'login', 'handphone', 'beda', 'email', 'daftar', 'jenius', 'btpn', 'gagal', 'login', 'coilehaimk']",2,3,-1,Negatif
Wed Aug 04 16:27:09 +0000 2021,1422957287488901124,tidak erti kali salah buka aplikasi buka twitter buka mbanking jenius,0,0,0,0,in,68977515,1422957287488901124,jigeng,https://twitter.com/jigeng/status/1422957287488901124,"['tidak erti', 'kali', 'salah', 'buka', 'aplikasi', 'buka', 'twitter', 'buka', 'mbanking', 'jenius']",1,1,0,Netral
Wed Aug 04 13:39:29 +0000 2021,1422915093600215049,enggak erti banget konsep jenius tagih bulan tagih aplikasi jatuh tempo panjang subscribe apple musik icloud dan lain lain saldo rangin gmnsih tidak jelas,0,1,0,0,in,1040255198843686912,1422915093600215049,lesyeuxdpinkies,https://twitter.com/lesyeuxdpinkies/status/1422915093600215049,"['enggak erti', 'banget', 'konsep', 'jenius', 'tagih', 'bulan', 'tagih', 'aplikasi', 'jatuh', 'tempo', 'panjang', 'subscribe', 'apple', 'musik', 'icloud', 'dan lain lain', 'saldo', 'rangin', 'gmnsih', 'tidak jelas']",1,3,-2,Negatif
Wed Aug 04 13:18:33 +0000 2021,1422909824157708298,jenius from btpn digibank from dbs tmrw from uob dan kawan kawan bank digital layan fokus aplikasi including buka rekening,0,0,0,1,in,3851296393,1422909030679269383,rievinska_rf,https://twitter.com/rievinska_rf/status/1422909824157708298,"['jenius', 'from', 'btpn', 'digibank', 'from', 'dbs', 'tmrw', 'from', 'uob', 'dan kawan kawan', 'bank', 'digital', 'layan', 'fokus', 'aplikasi', 'including', 'buka', 'rekening']",1,0,1,Positif
Wed Aug 04 12:51:16 +0000 2021,1422902960699281408,selamat malam budi desak kait aplikasi jenius hubung jenius help email jeniushelp com twitter chat aplikasi,0,2,0,0,in,2424890203,1422445593490694151,lifeatbtpn,https://twitter.com/lifeatbtpn/status/1422902960699281408,"['selamat', 'malam', 'budi', 'desak', 'kait', 'aplikasi', 'jenius', 'hubung', 'jenius', 'help', 'email', 'jeniushelp', 'com', 'twitter', 'chat', 'aplikasi']",3,0,3,Positif
Wed Aug 04 04:29:13 +0000 2021,1422776614484541441,sobatrupiah mohon informasi keluh alami kait layan selenggara rugi finansial aplikasi jenius,0,1,0,0,in,153667051,1422490377538334722,bank_indonesia,https://twitter.com/bank_indonesia/status/1422776614484541441,"['sobatrupiah', 'mohon', 'informasi', 'keluh', 'alami', 'kait', 'layan', 'selenggara', 'rugi', 'finansial', 'aplikasi', 'jenius']",1,0,1,Positif
Wed Aug 04 02:14:33 +0000 2021,1422742724789227521,min handphone aplikasi jenius pakai finger print tidak bisa terang koneksi putus kayak cophyetuzwr,0,1,0,0,in,358230894,1422742724789227521,mhgibran,https://twitter.com/mhgibran/status/1422742724789227521,"['min', 'handphone', 'aplikasi', 'jenius', 'pakai', 'finger', 'print', 'tidak bisa', 'terang', 'koneksi', 'putus', 'kayak', 'cophyetuzwr']",2,2,0,Netral
Wed Aug 04 01:31:24 +0000 2021,1422731863903272962,ribet aplikasi jenius leomt parah malas buka aplikasi,0,0,0,0,in,54189191,1422724838267899907,intan_sari,https://twitter.com/intan_sari/status/1422731863903272962,"['ribet', 'aplikasi', 'jenius', 'leomt', 'parah', 'malas', 'buka', 'aplikasi']",1,3,-2,Negatif
